{"$defs":{"TierBudget":{"additionalProperties":false,"properties":{"focus":{"exclusiveMinimum":0,"title":"Focus","type":"integer"},"hold":{"const":160,"default":160,"title":"Hold","type":"integer"},"radar":{"exclusiveMinimum":0,"title":"Radar","type":"integer"}},"required":["focus","radar"],"title":"TierBudget","type":"object"}},"$schema":"https://json-schema.org/draft/2020-12/schema","additionalProperties":false,"properties":{"budget_profile":{"default":"standard","enum":["low","standard","high"],"title":"Budget Profile","type":"string"},"budgets":{"additionalProperties":{"$ref":"#/$defs/TierBudget"},"title":"Budgets","type":"object"},"config_revision":{"const":"g2-pr4-config-v1","default":"g2-pr4-config-v1","title":"Config Revision","type":"string"},"focus_read_seconds":{"const":90,"default":90,"title":"Focus Read Seconds","type":"integer"},"generator_revision":{"const":"g2-rule-items-v1","default":"g2-rule-items-v1","title":"Generator Revision","type":"string"},"max_display_claims":{"const":3,"default":3,"title":"Max Display Claims","type":"integer"},"policy_revision":{"const":"g2-candidate-tier-v1","default":"g2-candidate-tier-v1","title":"Policy Revision","type":"string"},"radar_read_seconds":{"const":12,"default":12,"title":"Radar Read Seconds","type":"integer"},"template_revision":{"const":"g2-zh-templates-v1","default":"g2-zh-templates-v1","title":"Template Revision","type":"string"}},"title":"PR4Config","type":"object"}
