{"budget_profile":"standard","budgets":{"high":{"focus":1800,"hold":160,"radar":480},"low":{"focus":800,"hold":160,"radar":220},"standard":{"focus":1200,"hold":160,"radar":320}},"config_revision":"g2-pr4-config-v1","focus_read_seconds":90,"generator_revision":"g2-rule-items-v1","max_display_claims":3,"policy_revision":"g2-candidate-tier-v1","radar_read_seconds":12,"template_revision":"g2-zh-templates-v1"}
